{
  "repo_metadata": {
    "name": "Skill-RUP",
    "primary_language": "typescript",
    "repo_type": "application",
    "loc": 379692,
    "file_count": 1155
  },
  "languages": [
    {
      "name": "typescript",
      "percentage": 78.7,
      "lockfile_present": false
    },
    {
      "name": "rust",
      "percentage": 12.3,
      "lockfile_present": false
    },
    {
      "name": "python",
      "percentage": 5.21,
      "lockfile_present": false
    },
    {
      "name": "javascript",
      "percentage": 3.79,
      "lockfile_present": false
    }
  ],
  "tooling": {
    "test_framework": "pytest"
  },
  "gaps": [],
  "risk_assessment": {
    "overall_risk": "low",
    "technical_debt_score": 0,
    "production_readiness_score": 100
  }
}